{
  "$schema": "https://json-schema.org/draft/2020-12/schema",
  "$id": "https://emotionvector.local/schemas/phase_3_final_isolation_manifest_v0_1.schema.json",
  "title": "EmotionVector Phase 3 Final Isolation Manifest v0.1",
  "type": "object",
  "additionalProperties": false,
  "required": ["manifest_version", "status", "reviewer_id", "reviewed_at", "formal_review", "counts", "records", "checks", "claim_boundary"],
  "properties": {
    "manifest_version": {"const": "phase_3_final_isolation_manifest_v0_1"},
    "status": {"const": "human_semantic_merge_review_complete_no_split"},
    "reviewer_id": {"const": "researcher_01"},
    "reviewed_at": {"type": "string", "format": "date-time"},
    "formal_review": {"type": "object"},
    "counts": {"type": "object"},
    "records": {
      "type": "array", "minItems": 240, "maxItems": 240,
      "items": {
        "type": "object", "additionalProperties": false,
        "required": ["candidate_id", "cohort", "prompt_sha256", "final_isolation_family_id", "component_size", "review_decision", "split_status"],
        "properties": {
          "candidate_id": {"type": "string", "pattern": "^p3fam_[a-f0-9]{20}$"},
          "cohort": {"enum": ["confirmed_180", "expansion_60"]},
          "prompt_sha256": {"type": "string", "pattern": "^[a-f0-9]{64}$"},
          "final_isolation_family_id": {"type": "string", "pattern": "^p3iso_[a-f0-9]{20}$"},
          "component_size": {"type": "integer", "minimum": 1},
          "review_decision": {"enum": ["confirm", "merge"]},
          "split_status": {"const": "not_assigned_pending_40_15_40_feasibility"}
        }
      }
    },
    "checks": {"type": "array", "minItems": 8, "items": {"type": "object"}},
    "claim_boundary": {"type": "string", "minLength": 1}
  }
}
