{
  "checks": [
    {
      "check_id": "candidate_count_240",
      "status": "pass"
    },
    {
      "check_id": "identity_hash_and_cohort_preserved",
      "status": "pass"
    },
    {
      "check_id": "original_packet_unmodified",
      "status": "pass"
    },
    {
      "check_id": "merge_references_valid",
      "status": "pass"
    },
    {
      "check_id": "transitive_closure_complete",
      "status": "pass"
    },
    {
      "check_id": "one_family_id_per_component",
      "status": "pass"
    },
    {
      "check_id": "family_id_unique_across_components",
      "status": "pass"
    },
    {
      "check_id": "schema_valid",
      "status": "pass"
    },
    {
      "check_id": "split_assignment_zero",
      "status": "pass"
    }
  ],
  "claim_boundary": "Human semantic merge review is complete and transitively closed. This manifest contains no raw text and does not assign a split or establish model evidence.",
  "counts": {
    "component_size_distribution": {
      "1": 158,
      "2": 21,
      "3": 6,
      "5": 2,
      "6": 2
    },
    "confirm": 158,
    "exclude": 0,
    "final_isolation_families": 189,
    "merge": 82,
    "merged_components": 31
  },
  "formal_review": {
    "path": "results/local_artifacts/research_foundation/phase_3/phase_3_isolation_semantic_merge_review_completed_v0_1.jsonl",
    "row_count": 240,
    "sha256": "c0c9983d8ef9e58db1972106d56b8ae2739bb93068d5a5de12430468b0ffed4b",
    "tracked": false
  },
  "manifest_version": "phase_3_final_isolation_manifest_v0_1",
  "records": [
    {
      "candidate_id": "p3fam_00e03fc00d193c5fab77",
      "cohort": "confirmed_180",
      "component_size": 1,
      "final_isolation_family_id": "p3iso_515994bb872d70eaae06",
      "prompt_sha256": "81fbb0ae4142c1d4591a8db3afa25bcc5e7b05bd638fe7bad632b00c18196189",
      "review_decision": "confirm",
      "split_status": "not_assigned_pending_40_15_40_feasibility"
    },
    {
      "candidate_id": "p3fam_00efa369bfbe06dae05d",
      "cohort": "confirmed_180",
      "component_size": 1,
      "final_isolation_family_id": "p3iso_ba5e8c21edbf773c4403",
      "prompt_sha256": "07084a43e8f616988fd3822b567448c2eaef4e3c9fc3e0bd5e68294c90fb262c",
      "review_decision": "confirm",
      "split_status": "not_assigned_pending_40_15_40_feasibility"
    },
    {
      "candidate_id": "p3fam_0328184cf88dba4ede5e",
      "cohort": "confirmed_180",
      "component_size": 1,
      "final_isolation_family_id": "p3iso_8795da7b87838117599b",
      "prompt_sha256": "3fc4fb8ceca4f6cbd0af86ed7f88871f424220f29f203a6d15ef8e29b2f7a89b",
      "review_decision": "confirm",
      "split_status": "not_assigned_pending_40_15_40_feasibility"
    },
    {
      "candidate_id": "p3fam_034e5d823c7d9198981a",
      "cohort": "expansion_60",
      "component_size": 1,
      "final_isolation_family_id": "p3iso_127cd134d5bed9ed750c",
      "prompt_sha256": "daa27e2a9b3fd845e61ef6371e814e57bd7141032851a638a767935b471360bb",
      "review_decision": "confirm",
      "split_status": "not_assigned_pending_40_15_40_feasibility"
    },
    {
      "candidate_id": "p3fam_0423d3b908da2fac45c2",
      "cohort": "confirmed_180",
      "component_size": 1,
      "final_isolation_family_id": "p3iso_700a7f1549c1851a5e11",
      "prompt_sha256": "19440fe3c7b77e94102501797cffa21af62f704a5764b5772cccfa0cf2cf0214",
      "review_decision": "confirm",
      "split_status": "not_assigned_pending_40_15_40_feasibility"
    },
    {
      "candidate_id": "p3fam_044c936667547a0f3d62",
      "cohort": "confirmed_180",
      "component_size": 1,
      "final_isolation_family_id": "p3iso_fe4f99ba50ee580bf48d",
      "prompt_sha256": "b95e2b797bc5892a4e1bf3d25fecc2ebdd3d793ff97eefe611e8b69c8ff027a6",
      "review_decision": "confirm",
      "split_status": "not_assigned_pending_40_15_40_feasibility"
    },
    {
      "candidate_id": "p3fam_04b83a41278d1e7a3d87",
      "cohort": "expansion_60",
      "component_size": 1,
      "final_isolation_family_id": "p3iso_f65f625ccbc72086e785",
      "prompt_sha256": "dc12a37609ae31d809558e3b02f685f43c6a34365d66ad353bfd59710df1c848",
      "review_decision": "confirm",
      "split_status": "not_assigned_pending_40_15_40_feasibility"
    },
    {
      "candidate_id": "p3fam_05b2c005604d5afaa287",
      "cohort": "confirmed_180",
      "component_size": 2,
      "final_isolation_family_id": "p3iso_0509ff6bc967ebaa10f8",
      "prompt_sha256": "9d38e4f10f4878d642e7deca144ce567f6504b54743553d95cbc39b9bc9adb55",
      "review_decision": "merge",
      "split_status": "not_assigned_pending_40_15_40_feasibility"
    },
    {
      "candidate_id": "p3fam_0605be27c23a8e48620c",
      "cohort": "expansion_60",
      "component_size": 1,
      "final_isolation_family_id": "p3iso_67b9068118f34693259c",
      "prompt_sha256": "6b486b58b9b4fc060feea70739547966a5fcbd46ad3bd1e2419c16b566e94e26",
      "review_decision": "confirm",
      "split_status": "not_assigned_pending_40_15_40_feasibility"
    },
    {
      "candidate_id": "p3fam_06ced1573e08208b71de",
      "cohort": "confirmed_180",
      "component_size": 2,
      "final_isolation_family_id": "p3iso_a8c8cbbe2abcbb002f51",
      "prompt_sha256": "f3631f001e57835706d30156d39cc2f4ad8e1413e5b9c4ca9faa813d9bb1e49d",
      "review_decision": "merge",
      "split_status": "not_assigned_pending_40_15_40_feasibility"
    },
    {
      "candidate_id": "p3fam_0746224b44a05057860c",
      "cohort": "confirmed_180",
      "component_size": 1,
      "final_isolation_family_id": "p3iso_82b3254c1b1c73d57c26",
      "prompt_sha256": "3f68675824f142ece0899c7e0cc7d3599860af25a420ebd8a19ae11f7115abb0",
      "review_decision": "confirm",
      "split_status": "not_assigned_pending_40_15_40_feasibility"
    },
    {
      "candidate_id": "p3fam_07ca196e0047d5ead6bf",
      "cohort": "confirmed_180",
      "component_size": 1,
      "final_isolation_family_id": "p3iso_3bcf16e3342730f0a3ac",
      "prompt_sha256": "86d96b42230471d00f8eaf635f9c1b93c10518bf9dbc169049efa34b9a74732c",
      "review_decision": "confirm",
      "split_status": "not_assigned_pending_40_15_40_feasibility"
    },
    {
      "candidate_id": "p3fam_07db6921c37fa1c41e60",
      "cohort": "confirmed_180",
      "component_size": 3,
      "final_isolation_family_id": "p3iso_69140bfb228c6063fb6b",
      "prompt_sha256": "eb0541167c483b9e778b5770025913536cda2233563b85839e22deb294e00021",
      "review_decision": "merge",
      "split_status": "not_assigned_pending_40_15_40_feasibility"
    },
    {
      "candidate_id": "p3fam_0853b4838e4bf8af3e4d",
      "cohort": "confirmed_180",
      "component_size": 1,
      "final_isolation_family_id": "p3iso_837ff46b36b3e7b5a2a6",
      "prompt_sha256": "762b948e5fbdb59a043ee4285a59e2f64fc04ee10142b3b342de0ff9ff028e44",
      "review_decision": "confirm",
      "split_status": "not_assigned_pending_40_15_40_feasibility"
    },
    {
      "candidate_id": "p3fam_0aea17b3347152a19405",
      "cohort": "expansion_60",
      "component_size": 2,
      "final_isolation_family_id": "p3iso_5b703959e795fd179ca7",
      "prompt_sha256": "2021fd4bb2a683eb1ece327f81a8e413df362ba0d5a1b423a5441d2d1b2090ca",
      "review_decision": "merge",
      "split_status": "not_assigned_pending_40_15_40_feasibility"
    },
    {
      "candidate_id": "p3fam_0dacdd67712611c3d241",
      "cohort": "confirmed_180",
      "component_size": 1,
      "final_isolation_family_id": "p3iso_a72a745bf0be599f43e6",
      "prompt_sha256": "9abc39c5c3f554b13eb65922c8905884b19de9d8ea1c3723fdc847b5f63d8f05",
      "review_decision": "confirm",
      "split_status": "not_assigned_pending_40_15_40_feasibility"
    },
    {
      "candidate_id": "p3fam_0dc65e96122b4095c09b",
      "cohort": "confirmed_180",
      "component_size": 1,
      "final_isolation_family_id": "p3iso_2b791ec45c82394be4ce",
      "prompt_sha256": "743bdb5430fb397143586d3b9b5991e28833095e8abde7ee7f80de0b2f6a106a",
      "review_decision": "confirm",
      "split_status": "not_assigned_pending_40_15_40_feasibility"
    },
    {
      "candidate_id": "p3fam_0e25102df53b3e3f13ed",
      "cohort": "confirmed_180",
      "component_size": 1,
      "final_isolation_family_id": "p3iso_69f73d0ad81f649a07e3",
      "prompt_sha256": "d5232e46ce9e9a15242c85d2f980b5a8cd3426a1b451d69ba4a65b8e2d42e5d6",
      "review_decision": "confirm",
      "split_status": "not_assigned_pending_40_15_40_feasibility"
    },
    {
      "candidate_id": "p3fam_1012c82a341a89229b7f",
      "cohort": "confirmed_180",
      "component_size": 6,
      "final_isolation_family_id": "p3iso_6b4fdbf6ce85d15102e4",
      "prompt_sha256": "2641dd89083c96a072fc590ac7012d8491c880acf6793c8ae4c29ad9f5184795",
      "review_decision": "merge",
      "split_status": "not_assigned_pending_40_15_40_feasibility"
    },
    {
      "candidate_id": "p3fam_103855382fa60550220c",
      "cohort": "confirmed_180",
      "component_size": 1,
      "final_isolation_family_id": "p3iso_b7127f602b1e26afd7b1",
      "prompt_sha256": "84c17c4660ae810ff4557e74742c35087892eb35d2c8aa7b1e5e4cfad8a97cc5",
      "review_decision": "confirm",
      "split_status": "not_assigned_pending_40_15_40_feasibility"
    },
    {
      "candidate_id": "p3fam_10febee24141f9128aa0",
      "cohort": "confirmed_180",
      "component_size": 1,
      "final_isolation_family_id": "p3iso_33cd623ccf0ba2e746d7",
      "prompt_sha256": "0cb5a68a5a85653a71ed7f4e7982d1d89b1e6b262f33a197ff6a257c6390071a",
      "review_decision": "confirm",
      "split_status": "not_assigned_pending_40_15_40_feasibility"
    },
    {
      "candidate_id": "p3fam_1134cb00d225094b7fc0",
      "cohort": "expansion_60",
      "component_size": 1,
      "final_isolation_family_id": "p3iso_4d1ffc93754588bc2dcf",
      "prompt_sha256": "aa4d30ef7ae982f6039558f57179d4926a25c072f8360d5cb0c91f3c47b23d02",
      "review_decision": "confirm",
      "split_status": "not_assigned_pending_40_15_40_feasibility"
    },
    {